{
  "metadata": {
    "instance_id": "final_proposal_example",
    "difficulty": "worked_example",
    "scenario": "fully_serviceable",
    "seed": 0,
    "generator_version": "manual-1.0-no-cold-time-limit",
    "cold_chain_time_limit_enabled": false
  },
  "parameters": {
    "service_minutes": 10,
    "loading_minutes": 5,
    "time_unit": "minutes_from_midnight",
    "window_semantics": "service_start",
    "max_trips_per_vehicle": 1
  },
  "organisations": [
    {"id": "Org1", "depot": "D1", "shifts": [{"id": "Org1_Day", "start": 600, "end": 960}]},
    {
      "id": "Org2",
      "depot": "D2",
      "shifts": [
        {"id": "Org2_Morning", "start": 540, "end": 780},
        {"id": "Org2_Afternoon", "start": 780, "end": 1020}
      ]
    }
  ],
  "households": [
    {"id": "H1", "needs_trained_volunteer": false, "priority": 1},
    {"id": "H2", "needs_trained_volunteer": true, "priority": 3},
    {"id": "H3", "needs_trained_volunteer": false, "priority": 2},
    {"id": "H4", "needs_trained_volunteer": true, "priority": 2},
    {"id": "H5", "needs_trained_volunteer": false, "priority": 1}
  ],
  "volunteers": [
    {"id": "Ana", "organisation": "Org1", "role": "driver", "shift_id": "Org1_Day", "trained": false, "vehicle_id": "V1"},
    {"id": "Gus", "organisation": "Org1", "role": "driver", "shift_id": "Org1_Day", "trained": true, "vehicle_id": "V2"},
    {"id": "Ben", "organisation": "Org1", "role": "assistant", "shift_id": "Org1_Day", "trained": true, "vehicle_id": null},
    {"id": "Carl", "organisation": "Org2", "role": "driver", "shift_id": "Org2_Morning", "trained": false, "vehicle_id": "V3"},
    {"id": "Dina", "organisation": "Org2", "role": "driver", "shift_id": "Org2_Morning", "trained": false, "vehicle_id": "V4"},
    {"id": "Eli", "organisation": "Org2", "role": "assistant", "shift_id": "Org2_Morning", "trained": true, "vehicle_id": null},
    {"id": "Hana", "organisation": "Org2", "role": "driver", "shift_id": "Org2_Afternoon", "trained": false, "vehicle_id": "V5"},
    {"id": "Fay", "organisation": "Org2", "role": "assistant", "shift_id": "Org2_Afternoon", "trained": false, "vehicle_id": null}
  ],
  "vehicles": [
    {"id": "V1", "organisation": "Org1", "home_depot": "D1", "driver_id": "Ana", "seats": 3, "ambient_capacity": 6, "chilled_capacity": 4},
    {"id": "V2", "organisation": "Org1", "home_depot": "D1", "driver_id": "Gus", "seats": 2, "ambient_capacity": 3, "chilled_capacity": 0},
    {"id": "V3", "organisation": "Org2", "home_depot": "D2", "driver_id": "Carl", "seats": 3, "ambient_capacity": 5, "chilled_capacity": 3},
    {"id": "V4", "organisation": "Org2", "home_depot": "D2", "driver_id": "Dina", "seats": 2, "ambient_capacity": 3, "chilled_capacity": 0},
    {"id": "V5", "organisation": "Org2", "home_depot": "D2", "driver_id": "Hana", "seats": 2, "ambient_capacity": 3, "chilled_capacity": 2}
  ],
  "requests": [
    {"id": "R1", "organisation": "Org1", "household": "H1", "depot": "D1", "ambient_crates": 2, "chilled_crates": 0, "window_start": 630, "window_end": 660},
    {"id": "R2", "organisation": "Org1", "household": "H2", "depot": "D1", "ambient_crates": 3, "chilled_crates": 1, "window_start": 645, "window_end": 675},
    {"id": "R3", "organisation": "Org1", "household": "H3", "depot": "D1", "ambient_crates": 2, "chilled_crates": 0, "window_start": 660, "window_end": 690},
    {"id": "R4", "organisation": "Org2", "household": "H3", "depot": "D2", "ambient_crates": 1, "chilled_crates": 2, "window_start": 675, "window_end": 705},
    {"id": "R5", "organisation": "Org2", "household": "H4", "depot": "D2", "ambient_crates": 2, "chilled_crates": 0, "window_start": 645, "window_end": 675},
    {"id": "R6", "organisation": "Org2", "household": "H5", "depot": "D2", "ambient_crates": 3, "chilled_crates": 0, "window_start": 810, "window_end": 840},
    {"id": "R7", "organisation": "Org2", "household": "H2", "depot": "D2", "ambient_crates": 2, "chilled_crates": 0, "window_start": 810, "window_end": 840}
  ],
  "duplicate_households": [
    {"household": "H2", "competing_requests": ["R2", "R7"]},
    {"household": "H3", "competing_requests": ["R3", "R4"]}
  ],
  "travel_times": {
    "D1": {"D1": 0, "D2": 15, "H1": 10, "H2": 15, "H3": 20, "H4": 25, "H5": 30},
    "D2": {"D1": 15, "D2": 0, "H1": 20, "H2": 15, "H3": 10, "H4": 12, "H5": 18},
    "H1": {"D1": 10, "D2": 20, "H1": 0, "H2": 8, "H3": 22, "H4": 28, "H5": 32},
    "H2": {"D1": 15, "D2": 15, "H1": 8, "H2": 0, "H3": 14, "H4": 20, "H5": 24},
    "H3": {"D1": 20, "D2": 10, "H1": 22, "H2": 14, "H3": 0, "H4": 10, "H5": 15},
    "H4": {"D1": 25, "D2": 12, "H1": 28, "H2": 20, "H3": 10, "H4": 0, "H5": 12},
    "H5": {"D1": 30, "D2": 18, "H1": 32, "H2": 24, "H3": 15, "H4": 12, "H5": 0}
  }
}

